{
  "schema_version": 1,
  "incident_id": "emudhra-weak-intermediates-2026",
  "title": "eMudhra intermediate CA certificates with recoverable P-384 private keys",
  "data_version": "2026.10.22",
  "updated": "2026-10-22",
  "as_of": "2026-10-21",
  "classification": "certificate-authority-key-compromise",
  "is_malware_incident": false,
  "summary": "Eight intermediate CA private keys created in an eMudhra key ceremony on 2026-04-30 were generated with almost no entropy. Mozilla independently confirmed that every key was an integer below 256, i.e. recoverable by trying 256 candidates. A holder of a recovered key can mint certificates that an unpatched client accepts for any name (TLS) or for signed code (code signing). This is NOT evidence of malware on any machine: what an audit must answer is whether a client on this machine would still accept a chain through one of these keys.",
  "usage": [
    "tls",
    "code-signing"
  ],
  "primary_match_key": "spki_sha256",
  "primary_match_key_rationale": "The same private key appears in both an eMudhra-signed certificate and a Sectigo 'AAA Certificate Services' cross-signed certificate, so the subject/issuer names and certificate fingerprints differ while the SubjectPublicKeyInfo is identical. Matching on SPKI SHA-256 therefore catches both signing paths with one indicator.",
  "compromised_intermediates": [
    {
      "common_name": "EM DV TLS CA - G3B",
      "usage": "tls",
      "spki_sha256": "EBED6475C2C2D80FCB199F3FE8DD6E6B3CE60B77EB15D4E42C3DEC0C6F5B5105",
      "signing_paths": [
        "emudhra-direct",
        "sectigo-cross-signed"
      ]
    },
    {
      "common_name": "EM OV TLS CA - G3B",
      "usage": "tls",
      "spki_sha256": "43BFFA19D6EF651451F6841E019931E96F6F2EAEFF28AB4B6F1CE4576DE2717B",
      "signing_paths": [
        "emudhra-direct",
        "sectigo-cross-signed"
      ]
    },
    {
      "common_name": "EM EV TLS CA - G3B",
      "usage": "tls",
      "spki_sha256": "E0254C7FCDC265E2F0F8A428DABB75AB4AE039B4872D62F5EE57F0877D5A8A41",
      "signing_paths": [
        "emudhra-direct",
        "sectigo-cross-signed"
      ]
    },
    {
      "common_name": "EM DV TLS CA - G3C",
      "usage": "tls",
      "spki_sha256": "49DD353DC2B919A3770645117D0E60C16115E7D1BC259EEFE734B00EA434FE5F",
      "signing_paths": [
        "emudhra-direct",
        "sectigo-cross-signed"
      ]
    },
    {
      "common_name": "EM OV TLS CA - G3C",
      "usage": "tls",
      "spki_sha256": "63ECEFEE431D49523BC1136C4E72D0206A477086CAF606CD5CF025686C109CF8",
      "signing_paths": [
        "emudhra-direct",
        "sectigo-cross-signed"
      ]
    },
    {
      "common_name": "EM EV TLS CA - G3C",
      "usage": "tls",
      "spki_sha256": "5C0660A2B164910D8FF589C18E14552E9E0EC237DCEFE2CB736D41A4811F81A0",
      "signing_paths": [
        "emudhra-direct",
        "sectigo-cross-signed"
      ]
    },
    {
      "common_name": "EM OV CS CA - G3B",
      "usage": "code-signing",
      "spki_sha256": "EC4FFA1AD0AC88081314B7AAFFEF6A91F97CD57291BB5BA686C5415F5EB4F6B6",
      "signing_paths": [
        "emudhra-direct",
        "sectigo-cross-signed"
      ]
    },
    {
      "common_name": "EM OV CS CA - G3C",
      "usage": "code-signing",
      "spki_sha256": "92C063D67E8F14DB71D288E11266FFDAF69CBF115F7BAB14F3BC2F68D25E0E30",
      "signing_paths": [
        "emudhra-direct",
        "sectigo-cross-signed"
      ]
    }
  ],
  "certificate_sha256": [],
  "certificate_sha256_status": "not-transcribed",
  "certificate_sha256_note": "16 impacted certificates exist (8 keys x 2 signing paths). Their individual SHA-256 fingerprints, serial numbers and PEM bodies are published by the upstream tracker but are deliberately NOT copied into this release; redistribution terms for that file have not been confirmed. SPKI matching already covers all 16, so no detection capability is lost. See docs/data-provenance.md.",
  "certificate_count_expected": 16,
  "certificate_count_derivation": "8 compromised keys x 2 signing paths (eMudhra-signed and Sectigo cross-signed) = 16 certificates",
  "related_roots": [
    {
      "common_name": "emSign Root TLS CA - G3",
      "role": "issuer-of-emudhra-signed-tls-intermediates"
    },
    {
      "common_name": "emSign Root CS CA - G3",
      "role": "issuer-of-emudhra-signed-code-signing-intermediates"
    },
    {
      "common_name": "emSign ECC Root CA - G3",
      "role": "related-emudhra-root"
    },
    {
      "common_name": "AAA Certificate Services",
      "role": "sectigo-root-of-the-cross-signed-path",
      "note": "Widely trusted Sectigo root used by many unrelated certificates. Its presence is expected and is never, on its own, an indicator."
    }
  ],
  "root_presence_is_not_an_indicator": true,
  "root_presence_rationale": "Clients can and do keep these roots trusted while rejecting the specific compromised SPKIs (Chrome blocked the SPKI hashes via CRLSet rather than removing a root). Reporting a trusted root as a risk would be a false positive.",
  "network_test_hosts": [
    {
      "host": "emudhra.we-have-a-problem.com",
      "operator": "third-party community tracker",
      "purpose": "serves a certificate chaining to a compromised intermediate so that a successful TLS handshake indicates the client still trusts it",
      "opt_in_only": true,
      "privacy_note": "Connecting discloses your source IP address, TLS fingerprint and User-Agent to a third party that publishes aggregate statistics. Never contacted unless --network-test is passed explicitly with a host."
    }
  ],
  "timeline": [
    {
      "date": "2026-04-30",
      "event": "Key generation ceremony that produced the eight weak keys."
    },
    {
      "date": "2026-10-17",
      "event": "Chrome blocked the affected SPKI hashes via CRLSet by 19:45 UTC.",
      "source": "https://blog.google/security/protecting-chrome-and-android-users-from-compromised-emudhra-intermediate-ca-certificates"
    },
    {
      "date": "2026-10-21",
      "event": "eMudhra root-cause investigation still open; wrap/unwrap step on the HSM reported as the suspected origin.",
      "source": "https://emudhra.com/en/post/certificate-security-incident"
    }
  ],
  "credential_guidance": {
    "principle": "A weak CA key creates the capability for interception; it does not by itself show that any password or token on a given machine was intercepted. An audit tool must neither order a blanket rotation nor declare rotation unnecessary. It reports a conditional scope and the escalation criteria.",
    "conditions": [
      {
        "when": "A client on this machine accepted a compromised SPKI during some window, with no further evidence.",
        "state": "CREDENTIAL_REVIEW_REQUIRED",
        "do": [
          "Identify which destinations were contacted during the window.",
          "Review authentication logs, proxy logs and certificate logs for that window.",
          "Do not rotate everything reflexively; scope by what the evidence covers."
        ]
      },
      {
        "when": "Suspicious certificates, anomalous authentications, session misuse or tampered packages were observed.",
        "state": "CREDENTIAL_ACTION_REQUIRED",
        "do": [
          "Reset passwords for the accounts known to be affected.",
          "Revoke the related sessions and authentication tokens.",
          "Rotate API keys, deploy keys and CI secrets that could have been exposed.",
          "Have users change reused passwords on other services."
        ]
      },
      {
        "when": "Organisation-wide identity compromise is indicated.",
        "state": "ESCALATE",
        "do": [
          "This exceeds the scope of an endpoint audit: escalate to the organisation's incident response plan and follow the prescribed order of operations."
        ]
      }
    ],
    "sources": [
      {
        "url": "https://www.cisa.gov/news-events/alerts/2025/04/16/cisa-releases-guidance-credential-risks-associated-potential-legacy-oracle-cloud-compromise",
        "publisher": "CISA",
        "retrieved": "2026-10-21",
        "used_for": "evidence-scoped credential response: reset passwords for known affected users, monitor authentication logs, assess API keys tied to known affected identities, advise users to change reused passwords"
      },
      {
        "url": "https://www.cisa.gov/news-events/analysis-reports/ar21-134a",
        "publisher": "CISA",
        "retrieved": "2026-10-21",
        "used_for": "broader systemic-compromise measures and the requirement to carry out steps in the prescribed order"
      }
    ]
  },
  "sources": [
    {
      "url": "https://bugzilla.mozilla.org/show_bug.cgi?id=2083449",
      "publisher": "Mozilla",
      "retrieved": "2026-10-21",
      "used_for": "independent confirmation of key recoverability; enumeration of 8 direct + 8 cross-signed certificates"
    },
    {
      "url": "https://blog.google/security/protecting-chrome-and-android-users-from-compromised-emudhra-intermediate-ca-certificates",
      "publisher": "Google",
      "retrieved": "2026-10-21",
      "used_for": "impact description and Chrome CRLSet blocking timestamp"
    },
    {
      "url": "https://emudhra.com/en/post/certificate-security-incident",
      "publisher": "eMudhra",
      "retrieved": "2026-10-21",
      "used_for": "vendor statement, suspected cause, no known prior misuse"
    },
    {
      "url": "https://blog.cloudflare.com/emudhra-certificate-compromise",
      "publisher": "Cloudflare",
      "retrieved": "2026-10-21",
      "used_for": "impact is certificate authentication, not the TLS ciphers; do not disable verification"
    },
    {
      "url": "https://emudhra.we-have-a-problem.com/impacted-intermediates.json",
      "publisher": "community tracker",
      "retrieved": "2026-10-21",
      "used_for": "SPKI SHA-256 values transcribed into compromised_intermediates"
    },
    {